"id","name","position_id","student_id","statement","created_at"
1,"Alice Johnson",1,"STU001","I will represent all students voices","2025-08-29 20:28:43.851258"
2,"Bob Williams",1,"STU002","My focus is on improving school facilities","2025-08-29 20:28:43.851258"
3,"Carol Davis",2,"STU003","I will support the president and help all students","2025-08-29 20:28:43.851258"
4,"Alice Brown",1,"STU010","I will represent all students voices","2025-08-31 21:00:32.577557"
5,"Bob Green",1,"STU011","My focus is on improving school facilities","2025-08-31 21:00:32.577557"
